{
  "$schema": "https://json-schema.org/draft/2020-12/schema", "$id": "https://schemas.krdevops.local/design-system-knowledge-snapshot-v1",
  "type": "object", "additionalProperties": false, "required": ["snapshotId", "schemaVersion", "contentHash", "components", "sourceRevision", "publishStatus"],
  "properties": {
    "snapshotId": {"type": "string"}, "schemaVersion": {"const": "1.0"}, "contentHash": {"$ref": "https://schemas.krdevops.local/pipeline-evolution-common-v1#/$defs/sha256"}, "components": {"type": "object", "additionalProperties": false, "required": ["profile", "catalog", "registry", "token", "componentMapping", "assetManifest", "documentation"], "properties": {"profile": {"$ref": "https://schemas.krdevops.local/pipeline-evolution-common-v1#/$defs/artifactReference"}, "catalog": {"$ref": "https://schemas.krdevops.local/pipeline-evolution-common-v1#/$defs/artifactReference"}, "registry": {"$ref": "https://schemas.krdevops.local/pipeline-evolution-common-v1#/$defs/artifactReference"}, "token": {"$ref": "https://schemas.krdevops.local/pipeline-evolution-common-v1#/$defs/artifactReference"}, "componentMapping": {"$ref": "https://schemas.krdevops.local/pipeline-evolution-common-v1#/$defs/artifactReference"}, "assetManifest": {"$ref": "https://schemas.krdevops.local/pipeline-evolution-common-v1#/$defs/artifactReference"}, "documentation": {"$ref": "https://schemas.krdevops.local/pipeline-evolution-common-v1#/$defs/artifactReference"}}}, "sourceRevision": {"type": "string"}, "publishStatus": {"enum": ["DRAFT", "APPROVED", "PUBLISHED", "SUPERSEDED"]}, "approvedBy": {"type": ["string", "null"]}, "approvedAt": {"type": ["string", "null"], "format": "date-time"}
  }
}
