{"snapshotId":"ds-1","schemaVersion":"1.0","contentHash":"aaaaaaaaaaaaaaaaaaaaaaaaaaaaaaaaaaaaaaaaaaaaaaaaaaaaaaaaaaaaaaaa","components":{"profile":{"artifactId":"profile","artifactType":"DESIGN_SYSTEM_PROFILE","schemaVersion":"1.0","contentHash":"1111111111111111111111111111111111111111111111111111111111111111"},"catalog":{"artifactId":"catalog","artifactType":"COMPONENT_CATALOG","schemaVersion":"2.0","contentHash":"2222222222222222222222222222222222222222222222222222222222222222"},"registry":{"artifactId":"registry","artifactType":"COMPONENT_REGISTRY","schemaVersion":"3.0","contentHash":"3333333333333333333333333333333333333333333333333333333333333333"},"token":{"artifactId":"token","artifactType":"TOKEN_CATALOG","schemaVersion":"1.0","contentHash":"4444444444444444444444444444444444444444444444444444444444444444"},"componentMapping":{"artifactId":"mapping","artifactType":"COMPONENT_MAPPING","schemaVersion":"1.0","contentHash":"5555555555555555555555555555555555555555555555555555555555555555"},"assetManifest":{"artifactId":"assets","artifactType":"ASSET_MANIFEST","schemaVersion":"1.0","contentHash":"6666666666666666666666666666666666666666666666666666666666666666"},"documentation":{"artifactId":"docs","artifactType":"DESIGN_DOCUMENTATION","schemaVersion":"1.0","contentHash":"7777777777777777777777777777777777777777777777777777777777777777"}},"sourceRevision":"r1","publishStatus":"APPROVED","approvedBy":"operator","approvedAt":"2026-08-23T00:00:00Z"}
